{"intent_digest":"sha-256:aaaaaaaaaaaaaaaaaaaaaaaaaaaaaaaaaaaaaaaaaaaaaaaaaaaaaaaaaaaaaaaa","obligations":[{"binding_digest":"sha-256:cccccccccccccccccccccccccccccccccccccccccccccccccccccccccccccccc","binding_kind":"generation","deadline":"2026-08-05T00:00:00.000Z","domain":"event","intent_digest":"sha-256:aaaaaaaaaaaaaaaaaaaaaaaaaaaaaaaaaaaaaaaaaaaaaaaaaaaaaaaaaaaaaaaa","operation_id":"0198cf64-cc00-7000-8000-000000000001","policy_digest":"sha-256:bbbbbbbbbbbbbbbbbbbbbbbbbbbbbbbbbbbbbbbbbbbbbbbbbbbbbbbbbbbbbbbb","profile":"yukh-transcript-backup-obligation/v0.1"},{"binding_digest":"sha-256:dddddddddddddddddddddddddddddddddddddddddddddddddddddddddddddddd","binding_kind":"absence_manifest","deadline":"2026-08-06T00:00:00.000Z","domain":"identity","intent_digest":"sha-256:aaaaaaaaaaaaaaaaaaaaaaaaaaaaaaaaaaaaaaaaaaaaaaaaaaaaaaaaaaaaaaaa","operation_id":"0198cf64-cc00-7000-8000-000000000001","policy_digest":"sha-256:bbbbbbbbbbbbbbbbbbbbbbbbbbbbbbbbbbbbbbbbbbbbbbbbbbbbbbbbbbbbbbbb","profile":"yukh-transcript-backup-obligation/v0.1"},{"binding_digest":"sha-256:eeeeeeeeeeeeeeeeeeeeeeeeeeeeeeeeeeeeeeeeeeeeeeeeeeeeeeeeeeeeeeee","binding_kind":"generation","deadline":"2026-08-07T00:00:00.000Z","domain":"security_audit","intent_digest":"sha-256:aaaaaaaaaaaaaaaaaaaaaaaaaaaaaaaaaaaaaaaaaaaaaaaaaaaaaaaaaaaaaaaa","operation_id":"0198cf64-cc00-7000-8000-000000000001","policy_digest":"sha-256:bbbbbbbbbbbbbbbbbbbbbbbbbbbbbbbbbbbbbbbbbbbbbbbbbbbbbbbbbbbbbbbb","profile":"yukh-transcript-backup-obligation/v0.1"}],"operation_id":"0198cf64-cc00-7000-8000-000000000001","policy_digest":"sha-256:bbbbbbbbbbbbbbbbbbbbbbbbbbbbbbbbbbbbbbbbbbbbbbbbbbbbbbbbbbbbbbbb","profile":"yukh-transcript-backup-obligation-set/v0.1"}