{"profile":"yukh-transcript-backup-obligation-set/v0.1","policy_digest":"sha-256:bbbbbbbbbbbbbbbbbbbbbbbbbbbbbbbbbbbbbbbbbbbbbbbbbbbbbbbbbbbbbbbb","operation_id":"0198cf64-cc00-7000-8000-000000000001","obligations":[{"profile":"yukh-transcript-backup-obligation/v0.1","policy_digest":"sha-256:bbbbbbbbbbbbbbbbbbbbbbbbbbbbbbbbbbbbbbbbbbbbbbbbbbbbbbbbbbbbbbbb","operation_id":"0198cf64-cc00-7000-8000-000000000001","domain":"event","binding_kind":"generation","deadline":"2026-08-05T00:00:00.000Z","intent_digest":"sha-256:aaaaaaaaaaaaaaaaaaaaaaaaaaaaaaaaaaaaaaaaaaaaaaaaaaaaaaaaaaaaaaaa","binding_digest":"sha-256:cccccccccccccccccccccccccccccccccccccccccccccccccccccccccccccccc"},{"profile":"yukh-transcript-backup-obligation/v0.1","policy_digest":"sha-256:bbbbbbbbbbbbbbbbbbbbbbbbbbbbbbbbbbbbbbbbbbbbbbbbbbbbbbbbbbbbbbbb","operation_id":"0198cf64-cc00-7000-8000-000000000001","domain":"identity","binding_kind":"absence_manifest","deadline":"2026-08-06T00:00:00.000Z","intent_digest":"sha-256:aaaaaaaaaaaaaaaaaaaaaaaaaaaaaaaaaaaaaaaaaaaaaaaaaaaaaaaaaaaaaaaa","binding_digest":"sha-256:dddddddddddddddddddddddddddddddddddddddddddddddddddddddddddddddd"},{"profile":"yukh-transcript-backup-obligation/v0.1","policy_digest":"sha-256:bbbbbbbbbbbbbbbbbbbbbbbbbbbbbbbbbbbbbbbbbbbbbbbbbbbbbbbbbbbbbbbb","operation_id":"0198cf64-cc00-7000-8000-000000000001","domain":"security_audit","binding_kind":"generation","deadline":"2026-08-07T00:00:00.000Z","intent_digest":"sha-256:aaaaaaaaaaaaaaaaaaaaaaaaaaaaaaaaaaaaaaaaaaaaaaaaaaaaaaaaaaaaaaaa","binding_digest":"sha-256:eeeeeeeeeeeeeeeeeeeeeeeeeeeeeeeeeeeeeeeeeeeeeeeeeeeeeeeeeeeeeeee"}],"intent_digest":"sha-256:aaaaaaaaaaaaaaaaaaaaaaaaaaaaaaaaaaaaaaaaaaaaaaaaaaaaaaaaaaaaaaaa"}